{
  "offer_id": "buyer-mortgage-auction",
  "buyer_id": "buyer_001",
  "active": true,
  "routing_mode": "auction",
  "vertical": "mortgage",
  "schema_version": "1.0.0",
  "countries": ["AU"],
  "state_regions": ["NSW", "VIC"],
  "channels": ["form", "api"],
  "excluded_source_types": ["scraped", "cold_outbound"],
  "reject_incentivized": true,
  "require_verified_phone": true,
  "require_consent_evidence": true,
  "reject_dnc_flagged": true,
  "reject_litigator_flagged": true,
  "reject_blacklist_flagged": true,
  "min_data_completeness": "standard",
  "max_spam_risk_score": 25,
  "floor_price_cents": 1500,
  "currency": "AUD",
  "payable_definition": "valid_contactable_form_lead",
  "daily_cap": 100,
  "hourly_cap": 20,
  "ping_timeout_seconds": 30,
  "webhook_url": "https://buyer.example/lcp/webhook"
}
